2.00E+11,1996,7,12,,0,,217,United States,1,North America,Washington,Spokane Valley,47.65878,-117.426047,1,0,20 South Pines,"07/12/1996: Two masked men detonated a pipe bomb at a Planned Parenthood office in Spokane Valley, Washington state, United States. In a related attack approximately five minutes later, two assailants robbed a nearby bank. The attackers left a notecontaining Christian Identity rhetoric and signed ""Phineas Priests"" at the Planned Parenthood location. Authorities report that the first attack was intended to divert attention from the second. The attack at the Planned Parenthood caused no casualties, but caused extensive damage to the lobby. In October 1996, authorities arrested three members of the Phineas Priesthood group, Robert Sherman Berry, Charles Harrison Barbee, and Verne Jay Merrell, in connection with the attack.",1,1,1,0,,,1,1,0,3,Bombing/Explosion,,,,,5,Abortion Related,40,Clinics,Planned Parenthood,Office,217,United States,,,,,,,,,,,,,,,,,Phineas Priesthood,,,,,,,0,,,0,4,4,1,5,Note left at scene,,,,,,,0,6,Explosives/Bombs/Dynamite,17,Other Explosive Type,,,,,,,,,,,,,Pipe bomb wrapped in #4 shot,0,0,0,0,0,0,1,3,Minor (likely < $1 million),,The explosion caused extensive destruction to the lobby.,0,,,,,,,,,,,,,,,,,"""Bank Robbery Follows Bombing; Similar to April Incident,"" Associated Press, July 12, 1996.","Federal Bureau of Investigation, Terrorism in the United States: 1996","Smith, Brent. ""Pre-incident Indicators of Terrorism Incidents: The Identification of Behavioral, Geographic, and Temporal Patterns of Preparatory Conduct,"" NIJ Report, May 2006.",UMD Miscellaneous,0,0,0,0,"199607120005, 199607120007"
2.00E+11,1996,7,12,,0,,217,United States,1,North America,Washington,Spokane Valley,47.65878,-117.426047,1,0,East Sprague Avenue,"07/12/1996: Two masked men armed with firearms and a propane tank rigged to a timer committed armed robbery at a U.S. Bank in Spokane Valley, Washington state, United States. In a related attack approximately five minutes earlier two assailants detonated a pipe bomb at a nearby Planned Parenthood office. The attackers left a note containing Christian Identity rhetoric and signed ""Phineas Priests"" at the Planned Parenthood location. Authorities report that the first attack was intended to divert attention from the second. The attack at the bank caused no damage or casualties, but the perpetrators escaped with $32,666. In October 1996, authorities arrested three members of the Phineas Priesthood group, Robert Sherman Berry, Charles Harrison Barbee, and Verne Jay Merrell, in connection with these attacks. In March 1997, a fourth group member, Brian Ratigan, was arrested in connection with these attacks.",1,1,1,0,,,1,1,0,2,Armed Assault,,,,,1,Business,3,Bank/Commerce,U.S. Bank,Branch,217,United States,,,,,,,,,,,,,,,,,Phineas Priesthood,,,,,,,0,,,0,4,4,0,,,,,,,,,,5,Firearms,2,Automatic Weapon,5,Firearms,4,Rifle/Shotgun (non-automatic),6,Explosives/Bombs/Dynamite,17,Other Explosive Type,,,,,AK-47; .12-gauge shotgun; revolver; 25 lb propane tank bomb rigged with a timer,0,0,0,0,0,0,0,,,,,1,-99,-99,0,0,,,0,,,,,,2,Hostage(s) released by perpetrators,-99,The U.S. Bank branch was the same location robbed in April 1996.,"""Bank Robbery Follows Bombing; Similar to April Incident,"" Associated Press, July 12, 1996.","Federal Bureau of Investigation, Terrorism in the United States: 1996","Smith, Brent. ""Pre-incident Indicators of Terrorism Incidents: The Identification of Behavioral, Geographic, and Temporal Patterns of Preparatory Conduct,"" NIJ Report, May 2006.",UMD Miscellaneous,0,0,0,0,"199607120007, 199607120005"
2.00E+11,1996,7,17,,0,,217,United States,1,North America,New York,New York City,40.712784,-74.005941,1,0,,,1,1,1,0,,,0,1,0,3,Bombing/Explosion,,,,,15,Religious Figures/Institutions,86,Place of Worship,,Synagogue,217,United States,,,,,,,,,,,,,,,,,Unknown,,,,,,,0,,,0,,,,,,,,,,,,,6,Explosives/Bombs/Dynamite,16,Unknown Explosive Type,,,,,,,,,,,,,Explosive,0,,,0,,,1,,,,,0,,,,,,,0,,,,,,,,,,,,,PGIS,-9,-9,0,-9,
2.00E+11,1996,7,22,,0,,217,United States,1,North America,Florida,Miami,25.764367,-80.201529,1,0,,,1,1,1,0,,,0,1,0,7,Facility/Infrastructure Attack,,,,,22,Violent Political Party,110,Party Office/Facility,Sandinista National Liberation Front (FSLN),Office,145,Nicaragua,,,,,,,,,,,,,,,,,Unknown,,,,,,,0,,,0,,,,,,,,,,,,,8,Incendiary,,,,,,,,,,,,,,,,0,,,0,,,1,,,,,0,,,,,,,0,,,,,,,,,,,,,PGIS,-9,-9,1,1,
2.00E+11,1996,7,27,,0,,217,United States,1,North America,Georgia,Atlanta,33.748315,-84.391109,1,0,,,1,1,1,0,,,0,1,0,3,Bombing/Explosion,,,,,14,Private Citizens & Property,78,"Procession/Gathering (funeral, wedding, birthday, religious)",,Olympic Games,217,United States,,,,,,,,,,,,,,,,,Army of God,,,,,,,0,,,0,,,,,,,,,,,,,6,Explosives/Bombs/Dynamite,16,Unknown Explosive Type,,,,,,,,,,,,,Explosive,1,1,,110,75,,1,,,,,0,,,,,,,0,,,,,,,,,,,,,PGIS,0,0,0,0,
2.00E+11,1996,8,16,,0,,217,United States,1,North America,Utah,West Jordan,40.60675,-111.938754,1,0,The incident occurred at a McDonald's nearing completion of construction at 1250 W and 9000 S.,"8/16/1996: Four animal-rights activists used a molotov cocktail and gasoline to set fire to a McDonald's fast food restaurant in West Jordan, Utah in the United States.  There were no injuries in the incident, which destroyed about 80% of the building under construction, which was nearing completion, causing at least $240,000 in damage.  In 2007, Mark Klein, Ryan Durfee, and Jason Troff were each sentenced to a year in prison after admitting their responsibility in the incident.  A fourth perpetrator was a 17-year old juvenile whose record was not released, was also charged in the incident after confessing, and then sentenced to probation.",1,1,1,0,,,0,1,0,7,Facility/Infrastructure Attack,,,,,1,Business,2,Restaurant/Bar/Café,McDonald's fast food restaurants,"McDonald's fast food restaurant in West Jordan, UT",217,United States,,,,,,,,,,,,,,,,,Animal Rights extremists,,,,,,"Allegedly, in protest of animal cruelty and ""the slaughter of cattle, chickens and fish.""",0,,,1,4,4,0,,,,,,,,,,8,Incendiary,19,Molotov Cocktail/Petrol Bomb,,,,,,,,,,,,,molotov cocktail and gasoline poured on the building,0,0,0,0,0,0,1,3,Minor (likely < $1 million),240000,building burned down and completely destroyed,0,,,,,,,0,,,,,,,,,"The incident occurred just before 2:00am. Some sources indicate damage may have been as high as $400,000.  The perpetrators denied any involvement in underground animal rights organizations such as ALF.","Mark L. Reece, ""2-Alarm Fire Burns 80% of a McDonald's,"" Deseret News, August 17, 1996.","Don Rosebrock, ""Animal-rights Activist is Jailed,"" Deseret News, October 20, 1997.","Tom Zoellner, ""Eatery Fire Traced To Animal Activists; Police: Suspects Have Admitted They Set Blaze,"" Salt Lake Tribune, January 4, 1997.",Eco Project 2010,-9,-9,0,-9,
2.00E+11,1996,8,24,,0,,217,United States,1,North America,Ohio,Akron,41.084195,-81.514059,1,0,,,1,1,1,1,2,Other Crime Type,0,1,0,3,Bombing/Explosion,,,,,14,Private Citizens & Property,78,"Procession/Gathering (funeral, wedding, birthday, religious)",,NEC World Series Golf Tournament,217,United States,,,,,,,,,,,,,,,,,Unknown,,,,,,,0,,,0,,,,,,,,,,,,,6,Explosives/Bombs/Dynamite,16,Unknown Explosive Type,,,,,,,,,,,,,Explosive,0,,,3,3,,1,,,,,0,,,,,,,0,,,,,,,,,,,,,PGIS,-9,-9,0,-9,
2.00E+11,1996,8,31,,0,,217,United States,1,North America,Tennessee,Piperton,35.04819,-89.620111,1,0,"at RusDun Farms Inc. in Piperton, Tennessee","8/31/1996: The Animal Liberation Front (ALF) claimed responsibility for planting four incendiary devices in trucks and the loading dock area of the RusDun Farms Inc. in Piperton, Tennessee in the United States. Only one of the firebombs ignited, causing damage to one of the trucks.  The group also said that they sabotaged warehouse air conditioner units.  The extent of monetary property damage is unknown.  There were no casualties in the incident.  ALF sent out a communiqué by fax to various news organizations, stating the group committed the attack on ''behalf of more than a half-million chickens imprisoned and in forced labor at the factory farm.''",1,1,1,0,,,0,1,0,7,Facility/Infrastructure Attack,,,,,1,Business,9,Farm/Ranch,RusDun Farms Inc.,"egg farm in Piperton, TN",217,United States,,,,,,,,,,,,,,,,,Animal Liberation Front (ALF),,,,,,"The perpetrators committed the incident on ""behalf of more than a half-million chickens imprisoned and in forced labor at the factory farm.''",0,,,0,-99,-99,1,1,Letter,,,,,,,,8,Incendiary,20,Gasoline or Alcohol,,,,,,,,,,,,,,0,0,0,0,0,0,1,4,Unknown,,one truck damaged,0,,,,,,,0,,,,,,,,,,"Tom Charlier, ""Fayette Egg Farm Firebombed; Animal Rights Group Takes Responsibility,"" The Commercial Appeal, September 1, 1996.",,,Eco Project 2010,0,1,0,1,
2.00E+11,1996,9,1,,0,,217,United States,1,North America,Oklahoma,Broken Arrow,36.050845,-95.789504,1,0,,,1,1,1,0,,,0,1,0,3,Bombing/Explosion,,,,,5,Abortion Related,40,Clinics,Planned Parenthood of E. Oklahoma + W. Arkansas,Clinic,217,United States,,,,,,,,,,,,,,,,,Anti-Abortion extremists,,,,,,,0,,,0,,,,,,,,,,,,,6,Explosives/Bombs/Dynamite,16,Unknown Explosive Type,,,,,,,,,,,,,Explosive,0,,,0,,,1,3,Minor (likely < $1 million),1000,,0,,,,,,,0,,,,,,,,,,,,,PGIS,-9,-9,0,-9,
2.00E+11,1996,9,10,,0,,217,United States,1,North America,Arizona,Tempe,33.42551,-111.937419,1,0,,,1,1,1,-9,,,0,1,0,8,Unarmed Assault,,,,,5,Abortion Related,40,Clinics,Planned Parenthood,Clinic,217,United States,,,,,,,,,,,,,,,,,Anti-Abortion extremists,,,,,,,0,,,1,1,1,,,,,,,,,,,9,Melee,21,Blunt Object,,,,,,,,,,,,,Club,0,,,0,,,1,,,,,0,,,,,,,0,,,,,,,,,,,,,PGIS,-9,-9,0,-9,
2.00E+11,1996,9,18,,0,,217,United States,1,North America,Oklahoma,Broken Arrow,36.050845,-95.789504,1,0,Device ignited at rear of building,"9/18/1996: A juvenile (whose name was not released by authorities) threw a Molotov cocktail at the Planned Parenthood of Eastern Oklahoma and Western Arkansas Broken Arrow Family Planning clinic in Oklahoma, United States.  There were no casualties but the abortion clinic was damaged.",1,1,1,0,,,0,1,0,7,Facility/Infrastructure Attack,,,,,5,Abortion Related,40,Clinics,,Planned Parenthood of Eastern Oklahoma and Western Arkansas Broken Arrow Family Planning clinic,217,United States,,,,,,,,,,,,,,,,,Anti-Abortion extremists,,,,,,To protest the practice of abortion and to sabotage abortion facilities operating in Oklahoma.,0,,,0,1,1,0,,,,,,,,,,8,Incendiary,19,Molotov Cocktail/Petrol Bomb,,,,,,,,,,,,,Molotov cocktail,0,0,0,0,0,0,1,3,Minor (likely < $1 million),,Rear of facility damaged,0,,,,,,,0,,,,,,,,,"Three days, the same perpetrator threw a Molotov cocktail into the same abortion clinic (199609010001).  The perpetrator claimed these two incidents as well as two other attacks against abortion clinics in the Tulsa area in a tape released to authorities (199701010006 and 199701190010).","""F.B.I. Joins Bombing Inquiry At Abortion Clinic in Tulsa,"" New York Times, January 21, 1997.","""Oklahoma Abortion Clinic Reopens After Bomb Attack,"" Lawrence Journal-World, January 22, 1997.",,Anti-Abortion Project 2010,-9,-9,0,-9,
2.00E+11,1996,10,3,,0,,217,United States,1,North America,California,Lancaster,34.698905,-118.144779,1,0,1255 W. Avenue I,"10/3/1996: Geoffrey Barr bombed the Back Door Bar, a gay establishment, in Lancaster, California, United States.  One person was injured and the bar sustained minor damage.",1,1,1,1,2,Other Crime Type,0,1,0,3,Bombing/Explosion,,,,,1,Business,2,Restaurant/Bar/Café,Gay establishment,"Back Door Bar, Lancaster California",217,United States,,,,,,,,,,,,,,,,,White extremists,,,,,,Hatred of homosexuals.,0,,,0,1,1,0,,,,,,,,,,6,Explosives/Bombs/Dynamite,16,Unknown Explosive Type,,,,,,,,,,,,,Explosive device,0,0,0,1,1,0,1,3,Minor (likely < $1 million),,Ceiling damaged and displays knocked off cases,0,,,,,,,0,,,,,,,,,The incident took place at 9:00 PM.  Geoffrey Barr was also convicted of stealing tools and smoke grenades from Edwards Air Force Base in California.,"""Lancaster Man Sentenced to Prison for Bombing Gay Bar,"" City News Service, June 13, 1997.","Jose Cardenas, ""Son Charged With Bombing, Gay Bar; Father Held in Theft,"" Los Angeles Times, February 21, 1997.","""Man Sentenced for Bombing Gay Bar,"" United Press International, June 13, 1997.",Hewitt Project,-9,-9,0,-9,
2.00E+11,1996,10,28,,0,,217,United States,1,North America,Oregon,Detroit,44.73573,-122.150849,1,0,"at the Detroit Ranger Station in Williamette National Forest in Detroit, OR","10/28/1996: Two members of the Animal Liberation Front (ALF) and Earth Liberation Front (ELF), Jacob Ferguson and Josephine Overaker, were responsible for placing two incendiary devices at the Detroit Ranger Station in the Williamette National Forest in Detroit, Oregon in the United States.  One device was lit and placed on the roof of the station, and the second ignited in the back of one of the United States Forest Service (USFS) pickup trucks.  The one on the roof failed to detonate, but the arson from the second incendiary caused about $21,500 worth of damage to the ranger station facilities.  There were no casualties in the incident.  Ferguson and Overtaker also spray-painted graffiti on the trucks and walls of the building with slogans such as “Earth Liberation Front,"" the anarchist “A,” and “STOP RAPING OUR FORESTS U.S.F.S.” Ferguson and Overtaker were part of a group calling themselves ""The Family,"" which proceeded to commit nearly 20 arson and ecotage attacks over a 6 year period.  Upon fear of a life behind bars, Ferguson became a government informant and witness in the case, landing him a sentence of 2 years probation, and as of 2008, Overtaker remained a fugitive being sought by the government after being indicted for her involvement in the crimes.",1,1,1,0,,,0,1,0,7,Facility/Infrastructure Attack,,,,,2,Government (General),21,Government Building/Facility/Office,"United States Forest Service, Detroit Ranger Station",building and trucks of the US Forest Service Detroit Ranger Station in Oregon,217,United States,,,,,,,,,,,,,,,,,Earth Liberation Front (ELF),The Family,Animal Liberation Front (ALF),The Family,,,To protest the logging of forests.,0,0,,0,2,1,1,5,Note left at scene,0,,,,,,,8,Incendiary,20,Gasoline or Alcohol,,,,,,,,,,,,,two incendiary devices lit with incense sticks,0,0,0,0,0,0,1,3,Minor (likely < $1 million),21500,damage to office building and trucks,0,,,,,,,0,,,,,,,,,"Ferguson and Overtaker also spray-painted graffiti on the trucks and walls of the building with slogans such as “Earth Liberation Front,"" the anarchist “A,” and “STOP RAPING OUR FORESTS U.S.F.S.”  Additionally, Elisha Dimatteo gave Ferguson and Overtaker a ride to Detroit and waited in the car while they placed the incendiaries at the station; however, the two never told Dimatteo of the incident, and it appears she was in no way knowingly involved in the actions of ALF or ELF.  She was never charged in the incident, but it is unknown if she was a member of either ELF or ALF.  Ferguson and Overtaker were part of a group of about 20 members from ELF and ALF, who called themselves ""The Family"" and committed nearly 20 acts of arson and ecotage over a 6 year period from 1995 through 2001.   By 2006, all but four of the perpetrators had been captured for their roles in various incidents, and by 2008, the 16 indicted members had been convicted and sentenced for their crimes. Four remained fugitives, including Overtaker.  Ferguson received 2 years probation in exchange for his role as a government informant and key witness.","Brent L. Smith and Kelly R. Damphousse, "" Patterns of precursor behaviors in the life span of a U.S. environmental terrorist group,"" Criminology & Public Policy, Volume 8, Issue 3, 2009.","U.S. Government’s Sentencing Memorandum for CR 06-60069, CR 06-60070, CR 06-60071, CR 06-60078, CR 06-60079, CR 06-60080, CR 06-60120, CR 06-60122, CR 06-60123, CR 06-60124, CR06-60125, and CR 06-60126. U.S. District Court: District of Oregon, Eugene, 2007.","William McCall, ""Radical 'snitch' in Western arsons gets probation,"" Associated Press State & Local Wire, June 4, 2008.",Eco Project 2010,0,1,0,1,
2.00E+11,1996,10,30,,0,,217,United States,1,North America,Oregon,Oakridge,43.747695,-122.456799,1,0,"at the US Forest Service Oakridge Ranger Station in Williamette National Forest in Oakridge, Oregon","10/30/1996: Three members of the Animal and Earth Liberation Fronts (ALF and ELF), Jacob Ferguson, Kevin Tubbs and Josephine Overaker, set a gasoline fire at the Oakridge Ranger Station in the Williamette National Forest in Oakridge, Oregon in the United States.  One incendiary device was placed in a recycling dumpster at the southwest corner of the ranger station, and the second was planted on the outside of one of the walls of the station, causing an estimated $3,316,150 in damages to replace the building, and $1,758,039 for the contents, for a total loss of $5,074,189, in addition to a vast amount of lost research material.  There were no casualties in the incident.  The three selected the Oakridge Ranger Station for the target of this arson due to their familiarity with it during their opposition to the Warner Creek timber sale sometime earlier.  The perpetrators were part of a group calling themselves ""The Family,"" which proceeded to commit nearly 20 arson and ecotage attacks over a 6 year period.  Upon fear of a life behind bars, Ferguson became a government informant and witness in the case, landing him a sentence of 2 years probation, and as of 2008, Overtaker remained a fugitive being sought by the government after being indicted for her involvement in the crimes. Tubbs was sentenced to 12 years and 7 months in prison for his involvement.",1,1,1,0,,,0,1,0,7,Facility/Infrastructure Attack,,,,,2,Government (General),18,"Government Personnel (excluding police, military)","United States Forest Service, Oakridge Ranger Station","US Forest Service Oakridge Ranger Station in Oakridge, Oregon",217,United States,,,,,,,,,,,,,,,,,Earth Liberation Front (ELF),The Family,Animal Liberation Front (ALF),The Family,,,To protest the logging of forests.,0,0,,0,3,2,0,,,0,,,,,,,8,Incendiary,20,Gasoline or Alcohol,,,,,,,,,,,,,incendiaries consisting of fuel in jugs and ignited,0,0,0,0,0,0,1,2,Major (likely > $1 million but < $1 billion),5000000,"over $5,000,000 in damages to the building, its contents and lost research material",0,,,,,,,0,,,,,,,,,"Once again, Elisha Dimatteo's car was borrowed to use in this incident, but she was not present at the attack, and she was never told that her car was used to transport and plant incendiaries.  It is unclear if she was part of ELF or ALF at all. Ferguson, Overtaker, and Tubbs were part of a group of about 20 members from ELF and ALF, who called themselves ""The Family"" and committed nearly 20 acts of arson and ecotage over a 6 year period from 1995 through 2001.   By 2006, all but four of the perpetrators had been captured for their roles in various incidents, and by 2008, the 16 indicted members had been convicted and sentenced for their crimes. Four remained fugitives, including Overtaker.  Ferguson received 2 years probation in exchange for his role as a government informant and key witness, and Tubbs received 12 years and 7 months in prison.","Brent L. Smith and Kelly R. Damphousse, "" Patterns of precursor behaviors in the life span of a U.S. environmental terrorist group,"" Criminology & Public Policy, Volume 8, Issue 3, 2009.","U.S. Government’s Sentencing Memorandum for CR 06-60069, CR 06-60070, CR 06-60071, CR 06-60078, CR 06-60079, CR 06-60080, CR 06-60120, CR 06-60122, CR 06-60123, CR 06-60124, CR06-60125, and CR 06-60126. U.S. District Court: District of Oregon, Eugene, 2007.","Legal Affairs Editors, ""Animal Liberation Front and Earth Liberation Front Members Sentenced in Oregon for Acts of Eco-Terrorism in Five Western States,"" PR Newswire Association LLC,  Public Interest Services, June 5, 2007.",Eco Project 2010,0,1,0,1,
2.00E+11,1996,11,1,,0,,217,United States,1,North America,Missouri,Hannibal,39.70355,-91.376109,1,0,,,1,1,1,-9,,,0,1,0,7,Facility/Infrastructure Attack,,,,,5,Abortion Related,40,Clinics,Family Planning Clinic,Clinic,217,United States,,,,,,,,,,,,,,,,,Unknown,,,,,,,0,,,0,,,,,,,,,,,,,8,Incendiary,,,,,,,,,,,,,,,,0,,,0,,,1,3,Minor (likely < $1 million),75000,,0,,,,,,,0,,,,,,,,,,,,,PGIS,-9,-9,0,-9,
2.00E+11,1996,11,12,,0,,217,United States,1,North America,Minnesota,Bloomington,44.820491,-93.306364,1,0,Normandale Boulevard,"11/12/1996:  Members of the Animal Liberation Front (ALF) are suspected to be responsible for throwing an incendiary through the window of Alaskan Fur Company Inc., near Bloomington, Minnesota in the United States, resulting in arson which caused an estimated $2 million in property damage to fur coats and other merchandise as well as $250,000 in structural damage to the two-story brick building.  There were no casualties in the incident.",1,1,1,0,,,0,1,0,7,Facility/Infrastructure Attack,,,,,1,Business,5,Industrial/Textiles/Factory,Alaskan Fur Company Inc.,"Alaskan Fur Company Inc. near Bloomington, MN",217,United States,,,,,,,,,,,,,,,,,Animal Liberation Front (ALF),,,,,,"Specific motive is unknown; however, other fur industries have been targeted by ALF in protest or the fur trade and mistreatment of animals.",1,,,0,-99,-99,0,,,,,,,,,,8,Incendiary,20,Gasoline or Alcohol,,,,,,,,,,,,,incendiary thrown through window,0,0,0,0,0,0,1,2,Major (likely > $1 million but < $1 billion),2250000,"estimated $2 million in damage to fur coats and other merchandise, and about $250,000 in structural property damage to the building",0,,,,,,,0,,,,,,,,,,"""Activists Revel in Fire at Fur-storage Business,"" St. Paul Pioneer Press, November 14, 1996.","Maria Elena Baca, ""Animal rights coalition condones fur-firm arson; Bloomington fire-bombing probed,"" Star Tribune, Minneapolis, November 14, 1996.","Steven Best and Anthony J. Nocella, ""Terrorists of Freedom Fighters?: Reflections on the liberation of animals,"" Lantern Books, 2004.",Eco Project 2010,0,1,0,1,
2.00E+11,1996,11,16,,0,,217,United States,1,North America,New Jersey,Fairton,39.380459,-75.216904,1,0,,,1,1,1,1,2,Other Crime Type,0,1,0,3,Bombing/Explosion,,,,,14,Private Citizens & Property,67,Unnamed Civilian/Unspecified,,Unk: Woman injured by postal bomb,,,,,,,,,,,,,,,,,,,Unknown,,,,,,,0,,,0,,,,,,,,,,,,,6,Explosives/Bombs/Dynamite,16,Unknown Explosive Type,,,,,,,,,,,,,Explosive,0,,,1,1,,1,,,,,0,,,,,,,0,,,,,,,,,,,,,PGIS,-9,-9,-9,-9,
2.00E+11,1996,12,1,,0,,217,United States,1,North America,Arizona,Phoenix,33.44826,-112.075774,1,0,,,1,1,1,-9,,,1,0,0,7,Facility/Infrastructure Attack,,,,,5,Abortion Related,40,Clinics,A-Z Women's Center,Clinic,217,United States,,,,,,,,,,,,,,,,,Unknown,,,,,,,0,,,0,,,,,,,,,,,,,8,Incendiary,,,,,,,,,,,,,,,,0,,,0,,,1,,,,,0,,,,,,,0,,,,,,,,,,,,,PGIS,-9,-9,0,-9,"199612010004, 199504250002, 199504250003, 199504250005, 199504250006"
2.00E+11,1996,12,1,,0,,217,United States,1,North America,Arizona,Phoenix,33.44826,-112.075774,1,0,,,1,1,1,-9,,,1,0,0,7,Facility/Infrastructure Attack,,,,,5,Abortion Related,40,Clinics,A-Z Women's Center,Clinic,217,United States,,,,,,,,,,,,,,,,,Unknown,,,,,,,0,,,0,,,,,,,,,,,,,8,Incendiary,,,,,,,,,,,,,,,,0,,,0,,,1,,,,,0,,,,,,,0,,,,,,,,,,,,,PGIS,-9,-9,0,-9,"199612010005, 199504250002, 199504250003, 199504250004, 199504250006"
2.00E+11,1996,12,1,,0,,217,United States,1,North America,Arizona,Phoenix,33.44826,-112.075774,1,0,,,1,1,1,-9,,,1,0,0,7,Facility/Infrastructure Attack,,,,,5,Abortion Related,40,Clinics,A-Z Women's Center,Clinic,217,United States,,,,,,,,,,,,,,,,,Unknown,,,,,,,0,,,0,,,,,,,,,,,,,8,Incendiary,,,,,,,,,,,,,,,,0,,,0,,,1,,,,,0,,,,,,,0,,,,,,,,,,,,,PGIS,-9,-9,0,-9,"199612010006, 199504250002, 199504250003, 199504250004, 199504250005"
2.00E+11,1996,12,18,,0,,217,United States,1,North America,Louisiana,New Orleans,29.951027,-90.071422,1,0,,,1,1,1,0,,,0,1,0,1,Assassination,,,,,5,Abortion Related,41,Personnel,Orleans Women's Clinic,Dr. Calvin Jackson,217,United States,,,,,,,,,,,,,,,,,Anti-Abortion extremists,,,,,,,0,,,1,1,,,,,,,,,,,,9,Melee,23,Knife or Other Sharp Object,,,,,,,,,,,,,Knife,0,,,1,1,,0,,,,,0,,,,,,,0,,,,,,,,,,,,,PGIS,-9,-9,0,-9,
2.00E+11,1997,1,1,,0,,217,United States,1,North America,Oklahoma,Tulsa,36.149745,-95.993334,1,0,,,1,1,1,-9,,,1,1,0,7,Facility/Infrastructure Attack,,,,,5,Abortion Related,40,Clinics,Reproductive Services,Abortion Clinic,217,United States,,,,,,,,,,,,,,,,,Anti-Abortion extremists,,,,,,,0,,,1,,1,,,,,,,,,,,8,Incendiary,,,,,,,,,,,,,,,Incendiary,0,,,0,,,1,,,,,0,,,,,,,0,,,,,,,,,,,,,PGIS,-9,-9,0,-9,"199701010003, 199701010004, 199701010005"
2.00E+11,1997,1,1,,0,,217,United States,1,North America,Oklahoma,Tulsa,36.149745,-95.993334,1,0,,,1,1,1,-9,,,1,1,0,7,Facility/Infrastructure Attack,,,,,5,Abortion Related,40,Clinics,Reproductive Services,Abortion Clinic,217,United States,,,,,,,,,,,,,,,,,Anti-Abortion extremists,,,,,,,0,,,1,,1,,,,,,,,,,,8,Incendiary,,,,,,,,,,,,,,,Incendiary,0,,,0,,,1,,,,,0,,,,,,,0,,,,,,,,,,,,,PGIS,-9,-9,0,-9,"199701010004, 199701010003, 199701010005"
2.00E+11,1997,1,1,,0,,217,United States,1,North America,Oklahoma,Tulsa,36.149745,-95.993334,1,0,,,1,1,1,-9,,,1,1,0,7,Facility/Infrastructure Attack,,,,,5,Abortion Related,40,Clinics,Reproductive Services,Abortion Clinic,217,United States,,,,,,,,,,,,,,,,,Anti-Abortion extremists,,,,,,,0,,,1,,1,,,,,,,,,,,8,Incendiary,,,,,,,,,,,,,,,Incendiary,0,,,0,,,1,,,,,0,,,,,,,0,,,,,,,,,,,,,PGIS,-9,-9,0,-9,"199701010005, 199701010003, 199701010004"
