1.99E+11,1986,3,6,,0,,217,United States,1,North America,Idaho,Hayden Lake,47.765793,-116.757971,1,0,at auto shop,"03/06/1986:  A packaged bomb was sent to Gary Solomon, a local Jewish businessman and owner of Solomon Trucking company in Hayden Lake, Idaho, United States.  No casualties resulted in the incident, and tit is unknown if any property damage resulted from the explosion.  This bomb was sent by David Dorr, leader of the Order II, a group that stemmed from the original Order, which had previously collapsed.  The Order II (Bruder Schweigen Strike Force II) was also anti-government which the group believed to be unrighteous, as well as anti-Semitic.",1,1,1,1,2,Other Crime Type,0,1,0,3,Bombing/Explosion,,,,,1,Business,,,"Gary Solomon, Jewish businessman","Gary Solomon, local Jewish businessman",217,United States,1,Business,7,Retail/Grocery/Bakery,Solomon Trucking,"Solomon Trucking, a trucking company and auto shop, owned by Gary Solomon, a Jewish man",217,United States,,,,,,,,,The Order II (Bruder Schweigen Strike Force II),,,,,,"Possibly anti-Semitic; The Order II was a group that arose after The Order collapsed, and the group was started by David Dorr, a former Aryan Nation member.  The group's goal was to carry out the white supremacist mission of the first version of The Order. The Order II was also against Jews and the government, which the group believed was unrighteous.",0,,,0,1,1,0,,,,,,,,,,6,Explosives/Bombs/Dynamite,17,Other Explosive Type,,,,,,,,,,,,,packaged bomb,0,0,0,0,0,0,-9,,,,,,,,,,,,,,,,,,,,,"The Order II was created to carry out the white supremacist mission of the original group which collapsed after members were captured.  David Dorr led The Order II (along with his wife) and the localized group followed the anti-government ideology of the  Order, maintaining that the government was unrighteous.  The group was also anti-Semitic and against minorities. David Dorr was eventually captured and sentenced for his crimes during his involvement with The Order II.","Brent L. Smith, ""Terrorism in America: Pipe Bombs and Pipe Dreams,"" State University of New York Press, 1994.","James Coates, ""A Bad Day in 'Beirut, Idaho' Experts Seek Clues to Bombings,"" Chicago Tribune, October 1, 1986.","""The Aryan Chronicles,"" The Spokesman-Review, Spokane Washington, December 30, 1986.",Hewitt Project,0,0,0,0,
1.99E+11,1986,3,13,,0,,217,United States,1,North America,Louisiana,Baton Rouge,30.443335,-91.186994,1,0,,"3/13/1986: Brent Paul Braud, Derrick James Jarreau, and Charles Albert Cheshire Jr. failed in their attempts to ignite a fire at the Acadian Women's Center in Baton Rouge, Louisiana, United States.",1,1,1,0,,,0,0,0,7,Facility/Infrastructure Attack,,,,,5,Abortion Related,40,Clinics,,Acadian Women's Center,217,United States,,,,,,,,,,,,,,,,,Anti-Abortion extremists,,,,,,To protest the practice of abortion and to sabotage abortion facilities operating in Louisiana.,0,,,0,3,3,0,,,,,,,,,,8,Incendiary,18,Arson/Fire,,,,,,,,,,,,,,0,0,0,0,0,0,0,,,,,0,,,,,,,0,,,,,,,,,The perpetrators were also convicted of setting a fire at two Baton Rouge abortion clinics five months earlier (198510270002 and 198510300010).,"""2 Indicted in Clinic Bombings,"" Spokane Chronicle, May 22, 1986.","""Two Plead Guilty in Arson Attempt,"" The Advocate, April 19, 1986.","""Pastor Disavows Ties To Arson Try,"" The Advocate, March 15, 1986.",Anti-Abortion Project 2010,-9,-9,0,-9,
1.99E+11,1986,3,17,,0,,217,United States,1,North America,Puerto Rico,Ponce,18.011091,-66.614182,1,0,,"3/17/1986: Suspected Puerto Rican nationalists placed a bomb at an Esso Service Station in Ponce, Puerto Rico.  The explosive device was discovered and subsequently disarmed.",1,1,1,1,2,Other Crime Type,0,0,0,3,Bombing/Explosion,,,,,1,Business,4,Multinational Corporation,Esso Service Station,Esso Service Station in Ponce Puerto Rico,217,United States,,,,,,,,,,,,,,,,,Puerto Rican Nationalists,,,,,,,0,,,0,-99,-99,0,,,,,,,,,,6,Explosives/Bombs/Dynamite,16,Unknown Explosive Type,,,,,,,,,,,,,Explosive device,0,0,0,0,0,0,0,,,,,0,,,,,,,0,,,,,,,,,"Seven days before this incident, a group called ""Commando Rojo"" claimed that they were going to begin a bombing campaign in Puerto Rico, which would include attacks against service stations in Ponce.  However, authorities did not know if ""Commando Rojo"" were the perpetrators of this incident.","""FBI Analysis of Terrorist Incidents in the United States 1986,"" Terrorist Research and Analytical Center, Terrorism Section Criminal Investigative Division, FBI, 1986.","Christopher Hewitt, ""Political Violence and Terrorism in Modern America: A Chronology,"" Praeger Security International, 2005.",,Hewitt Project,0,0,0,0,
1.99E+11,1986,3,18,,0,,217,United States,1,North America,California,Westminster,33.75178,-117.993468,1,0,Orange County,"3/18/1986:  Trahn Khan Van, a former South Vietnam government official, was shot and wounded outside of his real estate office in Westminster, California, United States.  He was shot by Be Tu Van Tran, who was angered by Van's support for the communist government of Vietnam.",1,1,1,0,,,0,0,0,1,Assassination,,,,,14,Private Citizens & Property,73,Vehicles/Transportation,Vietnamese-American supporting Vietnam's communist government,Tran Khan Van,223,Vietnam,,,,,,,,,,,,,,,,,Vietnamese Refugees,,,,,,To protest supporters of Vietnam's communist government within the American-Vietnamese community.,0,,,0,2,2,0,,,,,,,,,,5,Firearms,5,Unknown Gun Type,,,,,,,,,,,,,,0,0,0,1,0,0,0,,,,,0,,,,,,,0,,,,,,,,,"Tran Khan Van had recently declared his support for normalizing relations with Vietnam.  He had received threatening letters.  Cu Ngoc Duong drove Be Tu Van Tran to the scene of the shooting.  Both were members of the United Front for the Liberation of Vietnam, an American based organization of Vietnamese refugees which sought to overthrow Vietnam's communist government.","""Domestic News,"" United Press International, April 5, 1986.","Seth Mydans, ""War Continues for Vietnam Refugees,"" New York Times, August 25, 1989.","Eric Lichtblau and David Reyes, ""Vietnamese War Passions at Heart of Attack Trial,"" Los Angeles Times, May 14, 1989.",Hewitt Project,1,0,1,1,
1.99E+11,1986,4,14,,0,,217,United States,1,North America,Puerto Rico,Rio Piedras,18.402807,-66.050137,1,0,,"4/14/1986: Members of the Organization of Volunteers for the Puerto Rican Revolution bombed the student center at the University of Puerto Rico in Rio Piedras, Puerto Rico.  There were no casualties but a bathroom was damaged.",1,1,1,0,,,0,1,0,3,Bombing/Explosion,,,,,8,Educational Institution,49,School/University/Educational Building,"University of Puerto Rico, Rio Piedras",Student center at the University of Puerto Rico,163,Puerto Rico,,,,,,,,,,,,,,,,,Organization of Volunteers for the Puerto Rican Revolution,,,,,,To protest the recruitment of cartographers by the United States Army on campus,0,,,0,-99,-99,1,2,Call (post-incident),,,,,,,,6,Explosives/Bombs/Dynamite,16,Unknown Explosive Type,,,,,,,,,,,,,Explosive device,0,0,0,0,0,0,1,3,Minor (likely < $1 million),,,0,,,,,,,0,,,,,,,,,This incident took place around 6:15 PM.  The Organization of Volunteers for the Puerto Rican Revolution claimed this attack with an anonymous phone call to United Press International.,"""FBI Analysis of Terrorist Incidents in the United States 1986,"" Terrorist Research and Analytical Center, Terrorism Section Criminal Investigative Division, FBI, 1986.","""Caribbean News Briefs,"" United Press International, April 14, 1986.","Christopher Hewitt, ""Political Violence and Terrorism in Modern America: A Chronology,"" Praeger Security International, 2005.",Hewitt Project,0,0,0,0,
1.99E+11,1986,4,28,,0,,217,United States,1,North America,New York,New York City,40.712784,-74.005941,1,0,,,1,1,1,0,,,0,1,0,7,Facility/Infrastructure Attack,,,,,6,Airports & Aircraft,44,Airport,Pan Am Airlines,Pan Am Loading Dock,217,United States,,,,,,,,,,,,,,,,,Jewish Defense League (JDL),,,,,,,0,,,0,,,,,,,,,,,,,8,Incendiary,18,Arson/Fire,,,,,,,,,,,,,Fire bomb,,,,,,,1,,,,,0,,,,,,,0,,,,,,,,,,,,,HSI,0,0,0,0,
1.99E+11,1986,4,29,,0,,217,United States,1,North America,Puerto Rico,San Juan,18.46617,-66.106654,1,0,,,1,1,1,0,,,0,1,0,1,Assassination,,,,,3,Police,25,Police Security Forces/Officers,,Alejandro Gonzalez Molave-29; former police undercover agent,163,Puerto Rico,,,,,,,,,,,,,,,,,Organization of Volunteers for the Puerto Rican Revolution,,,,,,,0,,,0,,,,,,,,,,,,,5,Firearms,4,Rifle/Shotgun (non-automatic),,,,,,,,,,,,,Shotgun,1,,,0,,,0,,,,,0,,,,,,,0,,,,,,,,,,,,,PGIS,0,0,0,0,
1.99E+11,1986,5,13,,0,,217,United States,1,North America,Illinois,Rockford,42.271817,-89.094544,1,0,,"5/13/1986: Unknown perpetrators attempted to set a fire at the Northern Illinois Women's Center in Rockford, Illinois, United States.  There were no casualties and it is unknown if the abortion clinic sustained any damages.",1,1,1,0,,,0,0,0,7,Facility/Infrastructure Attack,,,,,5,Abortion Related,40,Clinics,,Northern Illinois Women's Center,217,United States,,,,,,,,,,,,,,,,,Anti-Abortion extremists,,,,,,To protest the practice of abortion and to sabotage abortion facilities operating in Illinois.,0,,,0,-99,-99,0,,,,,,,,,,8,Incendiary,18,Arson/Fire,,,,,,,,,,,,,,0,0,0,0,0,0,-9,4,Unknown,,,0,,,,,,,0,,,,,,,,,"This was one of five total attacks against the Northern Illinois Women's Center in seven month period (198610310007, 198611250003, 198612100008, and 198701060007).  David Holman was convicted of setting three of the fires (198611250003, 198612100008, and 198703080007), but it is unknown if he was the perpetrator of this incident.  The abortion clinic had previously been the subject of many picketers.","John O'Brien, ""Janitor Charged In Arson At  Abortion Clinic,"" Chicago Tribune, January 14, 1987.","Christopher Hewitt, ""Political Violence and Terrorism in Modern America: A Chronology,"" Praeger Security International, 2005.",,Anti-Abortion Project 2010,-9,-9,0,-9,
1.99E+11,1986,5,14,,0,,217,United States,1,North America,Arizona,Palo Verde,33.34835,-112.677484,1,0,"The incident occurred about 25-35 miles outside the nuclear power plant in Palo Verde, AZ","05/14/1986:  In Palo Verde, Arizona in the United States, unknown perpetrators sabotaged three 500,000-volt power lines (including the North Gila Line) to the Palo Verde Nuclear Generating Station, which is operated by the Arizona Nuclear Power Project, by climbing the towers and throwing metal-weighted ropes onto the wires.  The high-voltage power lines were short-circuited, and though no electricity was lost, damages were estimated at $29,000 for repairs to the power lines and set back construction on completion of the plant.",1,1,1,0,,,0,1,0,7,Facility/Infrastructure Attack,,,,,21,Utilities,107,Electricity,Arizona Nuclear Power Project,three high-voltage power lines to the Palo Verde nuclear plant,217,United States,21,Utilities,107,Electricity,Palo Verde Nuclear Generating Station,"power lines , Palo Verde Nuclear Generating Station",217,United States,,,,,,,,,Unknown,,,,,,Unknown,0,,,0,-99,-99,0,,,,,,,,,,11,Sabotage Equipment,,,,,,,,,,,,,,,metal-weighted ropes thrown onto wires to short circuit power lines,0,0,0,0,0,0,1,3,Minor (likely < $1 million),29000,"cost $29,000 in repairs to the power lines",0,,,,,,,0,,,,,,,,,"The lines connect Palo Verde, located 50 miles west of downtown Phoenix, with two parts of the Phoenix metropolitan area and Yuma, in extreme southwestern Arizona.","""High-Voltage Lines to N-Plant Short-Circuited; Sabotage Blamed,"" The Associated Press, May 15, 1986.","Larry Lopez, ""A Puzzling Case Of Apparent Nuclear Sabotage,"" The Associated Press, June 3, 1986.","Lori K. Weinraub, ""Palo Verde sabotage probed,"" Mohave Daily Miner, May 16, 1986.",Eco Project 2010,-9,-9,0,-9,
1.99E+11,1986,5,20,,0,,217,United States,1,North America,Ohio,Toledo,41.65381,-83.536259,1,0,Abortion clinic located on second floor of building,"5/20/1986: Marjorie Reed set fire to the building housing the Center for Choice in Toledo, Ohio, United States.  There were no casualties but the building sustained $200,000 in damages.",1,1,1,0,,,0,1,0,7,Facility/Infrastructure Attack,,,,,5,Abortion Related,40,Clinics,,Center for Choice,217,United States,,,,,,,,,,,,,,,,,Anti-Abortion extremists,,,,,,To protest the practice of abortion and to sabotage abortion facilities operating in Ohio.,0,,,0,1,1,0,,,,,,,,,,8,Incendiary,20,Gasoline or Alcohol,,,,,,,,,,,,,,0,0,0,0,0,0,1,3,Minor (likely < $1 million),200000,,0,,,,,,,0,,,,,,,,,The incident took place at 4:52 AM.  The abortion clinic had previously been the target of numerous protests.,"""Fire Damages Toledo Clinic,"" Associated Press, May 20, 1986.","""Arrest Anti-Abortion Activist,"" The Bryan Times, October 18, 1989.","""Fire Hits Building Housing Abortion Clinic,"" Los Angeles Times, May 20, 1986.",Anti-Abortion Project 2010,-9,-9,0,-9,
1.99E+11,1986,6,9,,0,,217,United States,1,North America,Kansas,Wichita,37.68698,-97.335579,1,0,Bomb placed outside of building,"6/9/1986: Unknown perpetrators detonated a bomb at the Women's Health Care Services Clinic in Wichita, Kansas, United States.  There were no casualties but the building sustained around $75,000 in damages.",1,1,1,0,,,0,1,0,3,Bombing/Explosion,,,,,5,Abortion Related,40,Clinics,,Women's Health Care Services Clinic,217,United States,,,,,,,,,,,,,,,,,Anti-Abortion extremists,,,,,,To protest the practice of abortion and to sabotage abortion facilities operating in Kansas.,0,,,0,-99,-99,0,,,,,,,,,,6,Explosives/Bombs/Dynamite,17,Other Explosive Type,,,,,,,,,,,,,Large homemade pipe bomb,0,0,0,0,0,0,1,3,Minor (likely < $1 million),75000,Eight to ten foot hole blown through exterior wall of building.,0,,,,,,,0,,,,,,,,,"Reports conflict as to whether the facility sustained $70,000 or $80,000 in damages.","""Hunt Continues in Wichita Bombing, Lawrence Journal-World, August 12, 1986.","""Agents Probe Clinic Bombing,"" Washington Post, June 11, 1986.","""Fire at Abortion Clinic Was Set,"" Washington Post, June 15, 1986.",Anti-Abortion Project 2010,-9,-9,0,-9,
1.99E+11,1986,6,14,,0,,217,United States,1,North America,Missouri,Manchester,38.59286,-90.510679,1,0,,"6/14/1986: Unknown perpetrators ignited a fire the Reproductive Health Services Clinic in Manchester, Missouri, United States.  There were no casualties but the abortion clinic sustained $100,000 in damages.",1,1,1,0,,,0,1,0,7,Facility/Infrastructure Attack,,,,,5,Abortion Related,40,Clinics,,Reproductive Health Services Clinic,217,United States,,,,,,,,,,,,,,,,,Anti-Abortion extremists,,,,,,To protest the practice of abortion and to sabotage abortion facilities operating in Missouri.,0,,,0,-99,-99,0,,,,,,,,,,8,Incendiary,20,Gasoline or Alcohol,,,,,,,,,,,,,Fire ignited with flammable liquid.,0,0,0,0,0,0,1,3,Minor (likely < $1 million),100000,Entrance and waiting room of abortion clinic damaged.,0,,,,,,,0,,,,,,,,,The abortion clinic had previously been subject to many protests.,"""Blaze Damages Abortion Clinic,"" Eugene Register-Guard, June 15, 1986.","""Fire at Abortion Clinic Was Set,"" Washington Post, June 15, 1986.","""Chronological History of Arsons and Bombings Against Abortion Providers,"" National Abortion Federation.",Anti-Abortion Project 2010,-9,-9,0,-9,
1.99E+11,1986,7,3,,0,,217,United States,1,North America,Illinois,Chicago,41.88415,-87.632409,1,0,330 E. 220 Street,"7/3/1986: Robert Ahlgren placed a pipe bomb outside of the Internal Revenue Service offices in Lombard, Illinois, United States.  The bomb detonated shattering windows and the glass doors of the facility.  There were no casualties.",1,1,1,0,,,0,1,0,3,Bombing/Explosion,,,,,2,Government (General),21,Government Building/Facility/Office,Internal Revenue Service,"Internal Revenue Service Office, Lombard Illinois",217,United States,,,,,,,,,,,,,,,,,Anti-Government Group,,,,,,To protest the IRS and the taxation system of the United States government,0,,,0,1,1,0,,,,,,,,,,6,Explosives/Bombs/Dynamite,28,Dynamite/TNT,,,,,,,,,,,,,Nine inch stick of dynamite placed in a clay pipe,0,0,0,0,0,0,1,3,Minor (likely < $1 million),,Glass doors and windows shattered,0,,,,,,,0,,,,,,,,,"This incident took place at 2:00 AM.  Ahlgren was associated with groups that protested the United States taxation system and believed that the IRS offices were ""an opportune target.""  His friends talked him into carrying out the attack.","Jess Bravin, ""Stick of Dynamite Blows Out Doors of Lombard IRS Office,"" Chicago Tribune, July 4, 1986.","""Guilty Plea in Federal Building Bomb,"" Chicago Tribune, October 30, 1986.","Christopher Hewitt, ""Political Violence and Terrorism in Modern America: A Chronology,"" Praeger Security International, 2005.",Hewitt Project,-9,-9,0,-9,
1.99E+11,1986,8,7,,0,,217,United States,1,North America,Idaho,Hayden,47.744503,-116.792062,1,0,7900 Franklin Street,"08/07/1986: A 12-inch pipe bomb exploded at Fred Bower's Classic Auto Restoration auto-repair shop in Hayden, Idaho, United States, causing about $2000 in damages.  No casualties resulted from the incident.  The perpetrators, David and Deborah Dorr, and suspected perpetrator Edward W. Hawley, were members of The Order II (also known as Bruder Schweigen Strike Force II) which was a group formed by David Dorr to continue to carry out the white supremacist mission of The Order, which collapsed after the group members were captured.  The Order II (like the first one) was also a splinter group of the Aryan Nation.",1,1,1,0,,,0,1,0,3,Bombing/Explosion,,,,,1,Business,5,Industrial/Textiles/Factory,Classic Auto Restoration,"Classic Auto Restoration, auto repair shop, owned by Fred Bower",217,United States,,,,,,,,,,,,,,,,,The Order II (Bruder Schweigen Strike Force II),,,,,,"The specific motive is unclear; however, The Order II was a group that arose after The Order collapsed, and the group was started by David Dorr, a former Aryan Nation member.  The group included other Aryan Nations members and its goal was to carry out the white supremacist mission of the first version of The Order. The Order II was also against the government, which the group believed was unrighteous.",0,,,0,2,2,0,,,,,,,,,,6,Explosives/Bombs/Dynamite,17,Other Explosive Type,,,,,,,,,,,,,12 inch pipebomb,0,0,0,0,0,0,1,3,Minor (likely < $1 million),2000,,,,,,,,,,,,,,,,,,"The motive for this incident is unclear.  A co-owner stated that one of the suspected perpetrators, Edward Hawley, had made threats about the job the shop did in painting his car; hence, this case is coded as doubt terrorism proper.  However, the group The Order II was created to carry out the white supremacist mission of the original group which collapsed after members were captured.  David and Deborah Dorr led the Order II and were eventually captured and sentence for their crimes with the group, as was Edward Hawley.","Brent L. Smith, ""Terrorism in America: Pipe Bombs and Pipe Dreams,"" State University of New York Press, 1994.","""One bombing suspect identified,"" United Press International, October 1, 1986.","""Chronology: This Year,"" The Spokesman-Review, Spokane, Washington, September 30, 1986.",Hewitt Project,0,0,0,0,
1.99E+11,1986,9,2,,0,,217,United States,1,North America,New York,New York City,40.712784,-74.005941,1,0,,,1,1,1,0,,,0,1,0,8,Unarmed Assault,,,,,1,Business,11,Entertainment/Cultural/Stadium/Casino,,Metropolitan Opera House,217,United States,,,,,,,,,,,,,,,,,Jewish Defense League (JDL),,,,,,,0,,,0,,,,,,,,,,,,,2,Chemical,,,,,,,,,,,,,,,Tear gas,0,0,0,32,,0,0,,,,,0,,,,,,,0,,,,,,,,,,,,,CBRN Global Chronology,0,0,0,0,
1.99E+11,1986,9,16,,0,,217,United States,1,North America,Idaho,Coeur D'Alene,47.677755,-116.776166,1,0,,,1,1,1,0,,,0,1,0,3,Bombing/Explosion,,,,,15,Religious Figures/Institutions,85,Religious Figure,,home of Roman Catholic priest,217,United States,,,,,,,,,,,,,,,,,The Order II (Bruder Schweigen Strike Force II),,,,,,,0,,,0,,,,,,,,,,,,,6,Explosives/Bombs/Dynamite,16,Unknown Explosive Type,,,,,,,,,,,,,Explosive,0,,,0,,,1,,,,,0,,,,,,,0,,,,,,,,,,,,,PGIS,0,0,0,0,
1.99E+11,1986,9,18,,0,,217,United States,1,North America,Puerto Rico,Toa Baja,18.44247,-66.253529,1,0,Through glass windows,"9/18/1986: Suspected members of El Movimiento Revolucionario Independinista threw two or three Molotov cocktails into the United States Army Recruiting Station in Toa Baja, Puerto Rico.  There were no casualties but the building sustained around $13,500 in damages.",1,1,1,0,,,0,1,0,7,Facility/Infrastructure Attack,,,,,4,Military,28,Military Recruiting Station/Academy,United States Army Recruiting Station,"United States Army Recruiting Station, Toa Baja Puerto Rico",217,United States,,,,,,,,,,,,,,,,,El Movimiento Revolucionario Independinista,,,,,,To protest the presence of the United States military in Puerto Rico,1,,,0,-99,-99,1,2,Call (post-incident),,,,,,,,8,Incendiary,19,Molotov Cocktail/Petrol Bomb,,,,,,,,,,,,,Two or three Molotov cocktails thrown through the window,0,0,0,0,0,0,1,3,Minor (likely < $1 million),13500,Furniture and computer system destroyed,0,,,,,,,0,,,,,,,,,,"""FBI Analysis of Terrorist Incidents in the United States 1986,"" Terrorist Research and Analytical Center, Terrorism Section Criminal Investigative Division, FBI, 1986.","""Caribbean News Briefs,"" United Press International, September 18, 1986.","Christopher Hewitt, ""Political Violence and Terrorism in Modern America: A Chronology,"" Praeger Security International, 2005.",Hewitt Project,0,0,0,0,
1.99E+11,1986,9,29,,0,,217,United States,1,North America,Idaho,Coeur D'Alene,47.677755,-116.780419,1,0,,,1,1,1,0,,,0,1,0,3,Bombing/Explosion,,,,,2,Government (General),21,Government Building/Facility/Office,,federal office bldg,217,United States,,,,,,,,,,,,,,,,,Aryan Nation,,,,,,,0,,,0,3,,,,,,,,,,,,6,Explosives/Bombs/Dynamite,14,Time Fuse,,,,,,,,,,,,,Explosive - timed,0,,,0,,,1,,,,"Damages: explosion/time bomb, broken windows, damaged building (office building)",0,,,,,,,0,,,,,,,,,,,,,PGIS,0,0,0,0,
1.99E+11,1986,9,29,,0,,217,United States,1,North America,Idaho,Coeur D'Alene,47.677755,-116.780419,1,0,,,1,1,1,0,,,0,0,0,3,Bombing/Explosion,,,,,4,Military,28,Military Recruiting Station/Academy,,armed services recruitment office,217,United States,,,,,,,,,,,,,,,,,Aryan Nation,,,,,,,0,,,0,3,,,,,,,,,,,,6,Explosives/Bombs/Dynamite,14,Time Fuse,,,,,,,,,,,,,Explosive - timed,0,,,0,,,0,3,Minor (likely < $1 million),0,,0,,,,,,,0,,,,,,,,,,,,,PGIS,0,0,0,0,
1.99E+11,1986,9,29,,0,,217,United States,1,North America,Idaho,Coeur D'Alene,47.677755,-116.780419,1,0,,,1,1,1,0,,,0,1,0,3,Bombing/Explosion,,,,,1,Business,2,Restaurant/Bar/Café,,Jax Restaurant,217,United States,,,,,,,,,,,,,,,,,Aryan Nation,,,,,,,0,,,0,3,,,,,,,,,,,,6,Explosives/Bombs/Dynamite,14,Time Fuse,,,,,,,,,,,,,Explosive - timed,0,,,0,,,1,,,,,0,,,,,,,0,,,,,,,,,,,,,PGIS,0,0,0,0,
1.99E+11,1986,9,29,,0,,217,United States,1,North America,Idaho,Coeur D'Alene,47.677755,-116.780419,1,0,,,1,1,1,0,,,0,1,0,3,Bombing/Explosion,,,,,1,Business,,,,Gibbs Mercantile bldg,217,United States,,,,,,,,,,,,,,,,,Aryan Nation,,,,,,,0,,,0,3,,,,,,,,,,,,6,Explosives/Bombs/Dynamite,14,Time Fuse,,,,,,,,,,,,,Explosive - timed,0,,,0,,,1,,,,"Damages: explosion/time bomb, destroyed roof and wall (building)",0,,,,,,,0,,,,,,,,,,,,,PGIS,0,0,0,0,
1.99E+11,1986,10,20,,0,,217,United States,1,North America,New York,New York City,40.712784,-74.005941,1,0,,,1,1,1,-9,,,0,1,0,7,Facility/Infrastructure Attack,,,,,1,Business,11,Entertainment/Cultural/Stadium/Casino,,Lincoln Center,217,United States,,,,,,,,,,,,,,,,,Unknown,,,,,,,0,,,0,,,,,,,,,,,,,8,Incendiary,,,,,,,,,,,,,,,Incendiary,0,,,0,,,1,,,,,0,,,,,,,0,,,,,,,,,,,,,PGIS,-9,-9,0,-9,
1.99E+11,1986,10,24,,0,,217,United States,1,North America,Michigan,Detroit,42.331685,-83.047924,1,0,,"10/24/1986: A pipe bomb exploded in the foyer of Dimic's Restaurant and Bar, a Yugoslavian establishment in Detroit, Michigan, United States. There were no casualties from the incident, but it is unknown whether any property damage resulted.  Additionally, the perpetrator(s) are unknown, and no individual or group claimed responsibility for the bombing, which authorities believe targeted Yugoslavian delegates present in the restaurant on this day.",1,1,1,1,2,Other Crime Type,0,1,0,3,Bombing/Explosion,,,,,7,Government (Diplomatic),45,"Diplomatic Personnel (outside of embassy, consulate)",Yugoslavian delegation,"Yugoslavian delegates at Yugoslav restaurant in Detroit, Michigan",235,Yugoslavia,1,Business,2,Restaurant/Bar/Café,Dimic's Restaurant and Bar,,217,United States,,,,,,,,,Unknown,,,,,,Unknown,0,,,0,-99,-99,0,,,,,,,,,,6,Explosives/Bombs/Dynamite,17,Other Explosive Type,,,,,,,,,,,,,pipe bomb,0,0,0,0,0,0,-9,,,,,,,,,,,,,,,,,,,,,Occurred at approximately 10:15pm.,"""FBI Analysis of Terrorist Incidents in the United States 1986,"" Terrorist Research and Analytical Center, Terrorism Section Criminal Investigative Division, FBI, 1986.",,,Hewitt Project,-9,-9,1,1,
